[
  {
    "document_id": "DOC-PMC-CARD-0008",
    "source_id": "SRC-PMC-001",
    "title": "Advances in Atrial Fibrillation Management: A Guide for General Internists",
    "medical_specialty": "Cardiology",
    "topics": ["Atrial fibrillation", "Rate control", "Rhythm control", "Stroke prevention"],
    "document_type": "review_article",
    "evidence_level": "moderate",
    "publication_date": "2024",
    "version": null,
    "url": "https://pmc.ncbi.nlm.nih.gov/articles/PMC11678337/",
    "doi": null,
    "license_name": "CC BY 4.0",
    "license_status": "approved",
    "rag_allowed": true,
    "question_generation_allowed": true,
    "retrieved_at": null,
    "sha256": null,
    "ingestion_status": "candidate",
    "notes": "Wave 2 verified candidate for atrial fibrillation. Licence/source verified; download, hash and local pipeline validation still pending."
  },
  {
    "document_id": "DOC-PMC-CARD-0009",
    "source_id": "SRC-PMC-001",
    "title": "Recent Advances and Future Directions in Syncope Management: A Comprehensive Narrative Review",
    "medical_specialty": "Cardiology",
    "topics": ["Syncope", "Transient loss of consciousness"],
    "document_type": "review_article",
    "evidence_level": "moderate",
    "publication_date": "2024",
    "version": null,
    "url": "https://pmc.ncbi.nlm.nih.gov/articles/PMC10856004/",
    "doi": null,
    "license_name": "CC BY 4.0",
    "license_status": "approved",
    "rag_allowed": true,
    "question_generation_allowed": true,
    "retrieved_at": null,
    "sha256": null,
    "ingestion_status": "candidate",
    "notes": "Wave 2 verified candidate for syncope. Licence/source verified; download, hash and local pipeline validation still pending."
  },
  {
    "document_id": "DOC-PMC-RESP-0003",
    "source_id": "SRC-PMC-001",
    "title": "Phenotype to Treatable Traits-Based Management in Chronic Obstructive Pulmonary Disease",
    "medical_specialty": "Respiratory Medicine",
    "topics": ["COPD", "Treatable traits"],
    "document_type": "review_article",
    "evidence_level": "moderate",
    "publication_date": "2024",
    "version": null,
    "url": "https://pmc.ncbi.nlm.nih.gov/articles/PMC11179745/",
    "doi": null,
    "license_name": "CC BY 4.0",
    "license_status": "approved",
    "rag_allowed": true,
    "question_generation_allowed": true,
    "retrieved_at": null,
    "sha256": null,
    "ingestion_status": "candidate",
    "notes": "Wave 2 verified candidate for COPD. Licence/source verified; download, hash and local pipeline validation still pending."
  },
  {
    "document_id": "DOC-PMC-EMERG-0001",
    "source_id": "SRC-PMC-001",
    "title": "Cardiopulmonary Resuscitation: Clinical Updates and Perspectives",
    "medical_specialty": "Emergency Medicine",
    "topics": ["Cardiac arrest", "CPR"],
    "document_type": "review_article",
    "evidence_level": "moderate",
    "publication_date": "2024",
    "version": null,
    "url": "https://pmc.ncbi.nlm.nih.gov/articles/PMC11084294/",
    "doi": null,
    "license_name": "CC BY 4.0",
    "license_status": "approved",
    "rag_allowed": true,
    "question_generation_allowed": true,
    "retrieved_at": null,
    "sha256": null,
    "ingestion_status": "candidate",
    "notes": "Wave 2 verified candidate for cardiac arrest/CPR supporting evidence. RCUK remains external UK ground truth. Download/hash/validation pending."
  },
  {
    "document_id": "DOC-PMC-RESP-0004",
    "source_id": "SRC-PMC-001",
    "title": "Comparison of Observation Alone Versus Interventional Procedures in Hemodynamically Stable Patients With Pneumothorax: A Systematic Review and Meta-Analysis",
    "medical_specialty": "Respiratory Medicine",
    "topics": ["Pneumothorax", "Conservative management"],
    "document_type": "systematic_review",
    "evidence_level": "moderate",
    "publication_date": "2024",
    "version": null,
    "url": "https://pmc.ncbi.nlm.nih.gov/articles/PMC11097702/",
    "doi": null,
    "license_name": "CC BY 4.0",
    "license_status": "approved",
    "rag_allowed": true,
    "question_generation_allowed": true,
    "retrieved_at": null,
    "sha256": null,
    "ingestion_status": "candidate",
    "notes": "Wave 2 verified candidate for stable pneumothorax. BTS 2023 remains reference-only UK ground truth. Download/hash/validation pending."
  },
  {
    "document_id": "DOC-PMC-RESP-0005",
    "source_id": "SRC-PMC-001",
    "title": "Diagnosis and Management of Acute Respiratory Distress Syndrome in a Time of COVID-19",
    "medical_specialty": "Respiratory Medicine",
    "topics": ["ARDS", "Acute hypoxemic respiratory failure"],
    "document_type": "review_article",
    "evidence_level": "moderate",
    "publication_date": "2020",
    "version": null,
    "url": "https://pmc.ncbi.nlm.nih.gov/articles/PMC7762111/",
    "doi": null,
    "license_name": "CC BY 4.0",
    "license_status": "approved",
    "rag_allowed": true,
    "question_generation_allowed": true,
    "retrieved_at": null,
    "sha256": null,
    "ingestion_status": "candidate",
    "notes": "Wave 2 ARDS candidate with explicit freshness caveat: 2020 COVID-era review. Newer broad evidence remains desirable. Download/hash/validation pending."
  },
  {
    "document_id": "DOC-PMC-CARD-0010",
    "source_id": "SRC-PMC-001",
    "title": "Management of cardiogenic shock: a narrative review",
    "medical_specialty": "Cardiology",
    "topics": ["Cardiogenic shock", "Hemodynamic support"],
    "document_type": "review_article",
    "evidence_level": "moderate",
    "publication_date": "2024",
    "version": null,
    "url": "https://pmc.ncbi.nlm.nih.gov/articles/PMC10980676/",
    "doi": null,
    "license_name": "CC BY 4.0",
    "license_status": "approved",
    "rag_allowed": true,
    "question_generation_allowed": true,
    "retrieved_at": null,
    "sha256": null,
    "ingestion_status": "candidate",
    "notes": "Wave 2 candidate for cardiogenic shock only; generic shock coverage remains partial. Download/hash/validation pending."
  },
  {
    "document_id": "DOC-PMC-CARD-0011",
    "source_id": "SRC-PMC-001",
    "title": "Native Infective Endocarditis: A State-of-the-Art-Review",
    "medical_specialty": "Cardiology",
    "topics": ["Infective endocarditis"],
    "document_type": "review_article",
    "evidence_level": "moderate",
    "publication_date": "2024",
    "version": null,
    "url": "https://pmc.ncbi.nlm.nih.gov/articles/PMC11278776/",
    "doi": null,
    "license_name": "CC BY 4.0",
    "license_status": "approved",
    "rag_allowed": true,
    "question_generation_allowed": true,
    "retrieved_at": null,
    "sha256": null,
    "ingestion_status": "candidate",
    "notes": "Wave 2 supporting evidence for infective endocarditis; current UK management authority remains unresolved. Download/hash/validation pending."
  },
  {
    "document_id": "DOC-PMC-CARD-0012",
    "source_id": "SRC-PMC-001",
    "title": "Implantable Cardiac Devices in Patients with Brady- and Tachy-Arrhythmias: An Update of the Literature",
    "medical_specialty": "Cardiology",
    "topics": ["Bradyarrhythmias", "AV block", "Tachyarrhythmias"],
    "document_type": "review_article",
    "evidence_level": "moderate",
    "publication_date": "2024",
    "version": null,
    "url": "https://pmc.ncbi.nlm.nih.gov/articles/PMC11267218/",
    "doi": null,
    "license_name": "CC BY 4.0",
    "license_status": "approved",
    "rag_allowed": true,
    "question_generation_allowed": true,
    "retrieved_at": null,
    "sha256": null,
    "ingestion_status": "candidate",
    "notes": "Wave 2 conduction/device evidence. Acute bradycardia algorithms remain incomplete. Download/hash/validation pending."
  },
  {
    "document_id": "DOC-PMC-CARD-0013",
    "source_id": "SRC-PMC-001",
    "title": "Diagnostic Challenges in Aortic Stenosis",
    "medical_specialty": "Cardiology",
    "topics": ["Aortic stenosis", "Aortic valve disease"],
    "document_type": "review_article",
    "evidence_level": "moderate",
    "publication_date": "2024",
    "version": null,
    "url": "https://pmc.ncbi.nlm.nih.gov/articles/PMC11203729/",
    "doi": null,
    "license_name": "CC BY 4.0",
    "license_status": "approved",
    "rag_allowed": true,
    "question_generation_allowed": true,
    "retrieved_at": null,
    "sha256": null,
    "ingestion_status": "candidate",
    "notes": "Wave 2 aortic-stenosis support; reconcile management with NICE NG208. Download/hash/validation pending."
  },
  {
    "document_id": "DOC-PMC-CARD-0014",
    "source_id": "SRC-PMC-001",
    "title": "Functional Mitral Valve Regurgitation: Mitral Valve Repair or Replacement? Our “Road Map” for the Appropriate Strategy",
    "medical_specialty": "Cardiology",
    "topics": ["Mitral regurgitation", "Mitral valve disease"],
    "document_type": "review_article",
    "evidence_level": "moderate",
    "publication_date": "2024",
    "version": null,
    "url": "https://pmc.ncbi.nlm.nih.gov/articles/PMC11172680/",
    "doi": null,
    "license_name": "CC BY 4.0",
    "license_status": "approved",
    "rag_allowed": true,
    "question_generation_allowed": true,
    "retrieved_at": null,
    "sha256": null,
    "ingestion_status": "candidate",
    "notes": "Wave 2 mitral-regurgitation support; reconcile with NICE NG208. Download/hash/validation pending."
  }
]